{
  "blockers": [],
  "schema_version": "ethos-gate-zero-reproduction-env-v1",
  "source": "environment",
  "status": "complete",
  "variables": [
    {
      "exists": true,
      "expected_sha256": null,
      "hash_matches_expected": null,
      "kind": "file",
      "name": "ETHOS_PDFIUM_LIBRARY_PATH",
      "notes": [],
      "path": "/home/<private-user-pattern>/ethos-bench/pdfium/lib/libpdfium.so",
      "path_kind": "file",
      "role": "Pinned PDFium dynamic library loaded by ethos-pdf.",
      "sha256": "f728930966f503652b92acc89b9374a2eeca00ce42e26dccd3e4b5c5161b2d64",
      "size_bytes": 7645184,
      "status": "resolved",
      "tree_sha256": null,
      "value": "/home/<private-user-pattern>/ethos-bench/pdfium/lib/libpdfium.so"
    },
    {
      "exists": null,
      "expected_sha256": null,
      "hash_matches_expected": null,
      "kind": "value",
      "name": "ETHOS_PDFIUM_VERSION",
      "notes": [],
      "path": null,
      "path_kind": null,
      "role": "Pinned upstream PDFium version string.",
      "sha256": null,
      "size_bytes": null,
      "status": "resolved",
      "tree_sha256": null,
      "value": "chromium/7881"
    },
    {
      "exists": true,
      "expected_sha256": null,
      "hash_matches_expected": null,
      "kind": "file",
      "name": "ETHOS_PDFIUM_ARTIFACT_PATH",
      "notes": [],
      "path": "/home/<private-user-pattern>/ethos-bench/artifacts/pdfium-linux-x64.tgz",
      "path_kind": "file",
      "role": "Pinned PDFium artifact archive.",
      "sha256": "1470e21b8b4a3b4ad7f85684e2da11d94f3b69a86d81dee11b9b6709d927ac1d",
      "size_bytes": 3644759,
      "status": "resolved",
      "tree_sha256": null,
      "value": "/home/<private-user-pattern>/ethos-bench/artifacts/pdfium-linux-x64.tgz"
    },
    {
      "competitor_id": "opendataloader-pdf",
      "exists": true,
      "expected_sha256": null,
      "hash_matches_expected": null,
      "kind": "file",
      "name": "ETHOS_OPENDATALOADER_PDF_ARTIFACT",
      "notes": [],
      "path": "/home/<private-user-pattern>/ethos-bench/artifacts/opendataloader_pdf-2.4.7-py3-none-any.whl",
      "path_kind": "file",
      "role": "OpenDataLoader pinned artifact used to install/run the command.",
      "sha256": "1c359183650f4c012875010c156f13b6d3477b00762b8e3fbd8479fa03feb628",
      "size_bytes": 22568934,
      "status": "resolved",
      "tree_sha256": null,
      "value": "/home/<private-user-pattern>/ethos-bench/artifacts/opendataloader_pdf-2.4.7-py3-none-any.whl"
    },
    {
      "competitor_id": "opendataloader-pdf",
      "exists": true,
      "expected_sha256": null,
      "hash_matches_expected": null,
      "kind": "directory",
      "name": "ETHOS_OPENDATALOADER_PDF_INSTALL_PATH",
      "notes": [],
      "path": "/home/<private-user-pattern>/ethos-bench/venvs/odl",
      "path_kind": "directory",
      "role": "OpenDataLoader installed footprint path measured by the harness.",
      "sha256": null,
      "size_bytes": 128392275,
      "status": "resolved",
      "tree_sha256": "7007b38ef479bbf2ae6fee989c898e2521cc647506a52a2ba09203f99a33d17e",
      "value": "/home/<private-user-pattern>/ethos-bench/venvs/odl"
    }
  ]
}
