{
  "blockers": [],
  "schema_version": "ethos-gate-zero-reproduction-env-v1",
  "source": "environment",
  "status": "complete",
  "variables": [
    {
      "exists": true,
      "expected_sha256": null,
      "hash_matches_expected": null,
      "kind": "file",
      "name": "ETHOS_PDFIUM_LIBRARY_PATH",
      "notes": [],
      "path": "/private/tmp/ethos-pdfium/lib/libpdfium.dylib",
      "path_kind": "file",
      "role": "Pinned PDFium dynamic library loaded by ethos-pdf.",
      "sha256": "1bc45b15466b34cef96641ce25c77a876e70010c6b114f909dda2f5325fc5bd7",
      "size_bytes": 7732336,
      "status": "resolved",
      "tree_sha256": null,
      "value": "/private/tmp/ethos-pdfium/lib/libpdfium.dylib"
    },
    {
      "exists": null,
      "expected_sha256": null,
      "hash_matches_expected": null,
      "kind": "value",
      "name": "ETHOS_PDFIUM_VERSION",
      "notes": [],
      "path": null,
      "path_kind": null,
      "role": "Pinned upstream PDFium version string.",
      "sha256": null,
      "size_bytes": null,
      "status": "resolved",
      "tree_sha256": null,
      "value": "chromium/7881"
    },
    {
      "exists": true,
      "expected_sha256": null,
      "hash_matches_expected": null,
      "kind": "file",
      "name": "ETHOS_PDFIUM_ARTIFACT_PATH",
      "notes": [],
      "path": "/private/tmp/ethos-pdfium-mac-arm64.tgz",
      "path_kind": "file",
      "role": "Pinned PDFium artifact archive.",
      "sha256": "52e94ca5aa8847934330daf3f8150c190682c5ca93831468794f8b90d4392e40",
      "size_bytes": 3533019,
      "status": "resolved",
      "tree_sha256": null,
      "value": "/private/tmp/ethos-pdfium-mac-arm64.tgz"
    },
    {
      "competitor_id": "opendataloader-pdf",
      "exists": true,
      "expected_sha256": null,
      "hash_matches_expected": null,
      "kind": "file",
      "name": "ETHOS_OPENDATALOADER_PDF_ARTIFACT",
      "notes": [],
      "path": "/private/tmp/opendataloader_pdf-2.4.7-py3-none-any.whl",
      "path_kind": "file",
      "role": "OpenDataLoader pinned artifact used to install/run the command.",
      "sha256": "1c359183650f4c012875010c156f13b6d3477b00762b8e3fbd8479fa03feb628",
      "size_bytes": 22568934,
      "status": "resolved",
      "tree_sha256": null,
      "value": "/private/tmp/opendataloader_pdf-2.4.7-py3-none-any.whl"
    },
    {
      "competitor_id": "opendataloader-pdf",
      "exists": true,
      "expected_sha256": null,
      "hash_matches_expected": null,
      "kind": "directory",
      "name": "ETHOS_OPENDATALOADER_PDF_INSTALL_PATH",
      "notes": [],
      "path": "/private/tmp/ethos-odl-wheel-venv312",
      "path_kind": "directory",
      "role": "OpenDataLoader installed footprint path measured by the harness.",
      "sha256": null,
      "size_bytes": 35753427,
      "status": "resolved",
      "tree_sha256": "1a6dfd1db776762be4e486b77f3b982704c8f0bd32f3a1cbb7cf57e54f7103c2",
      "value": "/private/tmp/ethos-odl-wheel-venv312"
    }
  ]
}
