{
  "blockers": [],
  "schema_version": "ethos-gate-zero-reproduction-env-v1",
  "source": "environment",
  "status": "complete",
  "variables": [
    {
      "exists": true,
      "expected_sha256": null,
      "hash_matches_expected": null,
      "kind": "file",
      "name": "ETHOS_PDFIUM_LIBRARY_PATH",
      "notes": [],
      "path": "/private/tmp/ethos-pdfium/lib/libpdfium.dylib",
      "path_kind": "file",
      "role": "Pinned PDFium dynamic library loaded by ethos-pdf.",
      "sha256": "1bc45b15466b34cef96641ce25c77a876e70010c6b114f909dda2f5325fc5bd7",
      "size_bytes": 7732336,
      "status": "resolved",
      "tree_sha256": null,
      "value": "/private/tmp/ethos-pdfium/lib/libpdfium.dylib"
    },
    {
      "exists": null,
      "expected_sha256": null,
      "hash_matches_expected": null,
      "kind": "value",
      "name": "ETHOS_PDFIUM_VERSION",
      "notes": [],
      "path": null,
      "path_kind": null,
      "role": "Pinned upstream PDFium version string.",
      "sha256": null,
      "size_bytes": null,
      "status": "resolved",
      "tree_sha256": null,
      "value": "chromium/7881"
    },
    {
      "exists": true,
      "expected_sha256": null,
      "hash_matches_expected": null,
      "kind": "file",
      "name": "ETHOS_PDFIUM_ARTIFACT_PATH",
      "notes": [],
      "path": "/private/tmp/ethos-pdfium-mac-arm64.tgz",
      "path_kind": "file",
      "role": "Pinned PDFium artifact archive.",
      "sha256": "52e94ca5aa8847934330daf3f8150c190682c5ca93831468794f8b90d4392e40",
      "size_bytes": 3533019,
      "status": "resolved",
      "tree_sha256": null,
      "value": "/private/tmp/ethos-pdfium-mac-arm64.tgz"
    },
    {
      "competitor_id": "opendataloader-pdf",
      "exists": true,
      "expected_sha256": null,
      "hash_matches_expected": null,
      "kind": "file",
      "name": "ETHOS_OPENDATALOADER_PDF_BIN",
      "notes": [],
      "path": "/private/tmp/ethos-odl-wheel-venv312/bin/opendataloader-pdf",
      "path_kind": "file",
      "role": "OpenDataLoader command used by the Gate Zero harness.",
      "sha256": "cf3a8613d89e66ef9c394757144aed288af391e15df8b76e84a319a550d1fec3",
      "size_bytes": 249,
      "status": "resolved",
      "tree_sha256": null,
      "value": "/private/tmp/ethos-odl-wheel-venv312/bin/opendataloader-pdf"
    },
    {
      "competitor_id": "opendataloader-pdf",
      "exists": true,
      "expected_sha256": "1c359183650f4c012875010c156f13b6d3477b00762b8e3fbd8479fa03feb628",
      "hash_matches_expected": true,
      "kind": "file",
      "name": "ETHOS_OPENDATALOADER_PDF_ARTIFACT",
      "notes": [],
      "path": "/private/tmp/opendataloader_pdf-2.4.7-py3-none-any.whl",
      "path_kind": "file",
      "role": "OpenDataLoader pinned artifact used to install/run the command.",
      "sha256": "1c359183650f4c012875010c156f13b6d3477b00762b8e3fbd8479fa03feb628",
      "size_bytes": 22568934,
      "status": "resolved",
      "tree_sha256": null,
      "value": "/private/tmp/opendataloader_pdf-2.4.7-py3-none-any.whl"
    },
    {
      "competitor_id": "opendataloader-pdf",
      "exists": true,
      "expected_sha256": null,
      "hash_matches_expected": null,
      "kind": "directory",
      "name": "ETHOS_OPENDATALOADER_PDF_INSTALL_PATH",
      "notes": [],
      "path": "/private/tmp/ethos-odl-wheel-venv312",
      "path_kind": "directory",
      "role": "OpenDataLoader installed footprint path measured by the harness.",
      "sha256": null,
      "size_bytes": 35753427,
      "status": "resolved",
      "tree_sha256": "1a6dfd1db776762be4e486b77f3b982704c8f0bd32f3a1cbb7cf57e54f7103c2",
      "value": "/private/tmp/ethos-odl-wheel-venv312"
    },
    {
      "competitor_id": "edgeparse",
      "exists": true,
      "expected_sha256": null,
      "hash_matches_expected": null,
      "kind": "file",
      "name": "ETHOS_EDGEPARSE_BIN",
      "notes": [],
      "path": "/private/tmp/ethos-edgeparse-venv312/bin/edgeparse",
      "path_kind": "file",
      "role": "EdgeParse command used by the Gate Zero harness.",
      "sha256": "362767be721ff0bb39880b9c34cdfa28762ec44d91262a5f0c93a32c03cdb106",
      "size_bytes": 236,
      "status": "resolved",
      "tree_sha256": null,
      "value": "/private/tmp/ethos-edgeparse-venv312/bin/edgeparse"
    },
    {
      "competitor_id": "edgeparse",
      "exists": true,
      "expected_sha256": "82a6fdd81f2bfac4a3b8aedd06e055ae67ec8a2d1c879fb6327259caa13f5a69",
      "hash_matches_expected": true,
      "kind": "file",
      "name": "ETHOS_EDGEPARSE_ARTIFACT",
      "notes": [],
      "path": "/private/tmp/edgeparse-0.2.5-cp312-cp312-macosx_11_0_arm64.whl",
      "path_kind": "file",
      "role": "EdgeParse pinned artifact used to install/run the command.",
      "sha256": "82a6fdd81f2bfac4a3b8aedd06e055ae67ec8a2d1c879fb6327259caa13f5a69",
      "size_bytes": 4055477,
      "status": "resolved",
      "tree_sha256": null,
      "value": "/private/tmp/edgeparse-0.2.5-cp312-cp312-macosx_11_0_arm64.whl"
    },
    {
      "competitor_id": "edgeparse",
      "exists": true,
      "expected_sha256": null,
      "hash_matches_expected": null,
      "kind": "directory",
      "name": "ETHOS_EDGEPARSE_INSTALL_PATH",
      "notes": [],
      "path": "/private/tmp/ethos-edgeparse-venv312",
      "path_kind": "directory",
      "role": "EdgeParse installed footprint path measured by the harness.",
      "sha256": null,
      "size_bytes": 20383774,
      "status": "resolved",
      "tree_sha256": "1399c3fbe3f5d05d4b8772f7b955c90747d3dd0b7d8b64abf133acc1553dd665",
      "value": "/private/tmp/ethos-edgeparse-venv312"
    },
    {
      "competitor_id": "liteparse",
      "exists": true,
      "expected_sha256": null,
      "hash_matches_expected": null,
      "kind": "file",
      "name": "ETHOS_LITEPARSE_BIN",
      "notes": [],
      "path": "/private/tmp/ethos-liteparse-venv312/bin/lit",
      "path_kind": "file",
      "role": "LiteParse command used by the Gate Zero harness.",
      "sha256": "1fbce8aa8b70402477d5657930c483324779a35e6d282201d0f3b6402940551d",
      "size_bytes": 236,
      "status": "resolved",
      "tree_sha256": null,
      "value": "/private/tmp/ethos-liteparse-venv312/bin/lit"
    },
    {
      "competitor_id": "liteparse",
      "exists": true,
      "expected_sha256": "1486987ef620cec06b8dfc365505f15cd5cd4bb05dac3775d260633df7060779",
      "hash_matches_expected": true,
      "kind": "file",
      "name": "ETHOS_LITEPARSE_ARTIFACT",
      "notes": [],
      "path": "/private/tmp/liteparse-2.0.8-cp312-cp312-macosx_11_0_arm64.whl",
      "path_kind": "file",
      "role": "LiteParse pinned artifact used to install/run the command.",
      "sha256": "1486987ef620cec06b8dfc365505f15cd5cd4bb05dac3775d260633df7060779",
      "size_bytes": 7693258,
      "status": "resolved",
      "tree_sha256": null,
      "value": "/private/tmp/liteparse-2.0.8-cp312-cp312-macosx_11_0_arm64.whl"
    },
    {
      "competitor_id": "liteparse",
      "exists": true,
      "expected_sha256": null,
      "hash_matches_expected": null,
      "kind": "directory",
      "name": "ETHOS_LITEPARSE_INSTALL_PATH",
      "notes": [],
      "path": "/private/tmp/ethos-liteparse-venv312",
      "path_kind": "directory",
      "role": "LiteParse installed footprint path measured by the harness.",
      "sha256": null,
      "size_bytes": 28054699,
      "status": "resolved",
      "tree_sha256": "ed5154e8cc371e4b0af166d5e32e0a49e6ae1f8f38705ddd779b86926f3598d0",
      "value": "/private/tmp/ethos-liteparse-venv312"
    },
    {
      "competitor_id": "pymupdf4llm",
      "exists": true,
      "expected_sha256": null,
      "hash_matches_expected": null,
      "kind": "file",
      "name": "ETHOS_PYMUPDF4LLM_PYTHON",
      "notes": [],
      "path": "/private/tmp/ethos-pymupdf4llm-venv312/bin/python",
      "path_kind": "file",
      "role": "PyMuPDF4LLM Python interpreter used by the Gate Zero harness.",
      "sha256": "eb9d74b9c7cfdfb2c9b91614edb2c3607360ba46c5aa7fc4557b3a4a23e97cff",
      "size_bytes": 49968,
      "status": "resolved",
      "tree_sha256": null,
      "value": "/private/tmp/ethos-pymupdf4llm-venv312/bin/python"
    },
    {
      "competitor_id": "pymupdf4llm",
      "exists": true,
      "expected_sha256": "bd724b79fa3f06a5b28d7a65f7acfa8de56e04bdb603ac2d6dff315e0d151aaa",
      "hash_matches_expected": true,
      "kind": "file",
      "name": "ETHOS_PYMUPDF4LLM_ARTIFACT",
      "notes": [],
      "path": "/private/tmp/pymupdf4llm-1.27.2.3-py3-none-any.whl",
      "path_kind": "file",
      "role": "PyMuPDF4LLM pinned artifact used to install/run the command.",
      "sha256": "bd724b79fa3f06a5b28d7a65f7acfa8de56e04bdb603ac2d6dff315e0d151aaa",
      "size_bytes": 77348,
      "status": "resolved",
      "tree_sha256": null,
      "value": "/private/tmp/pymupdf4llm-1.27.2.3-py3-none-any.whl"
    },
    {
      "competitor_id": "pymupdf4llm",
      "exists": true,
      "expected_sha256": null,
      "hash_matches_expected": null,
      "kind": "directory",
      "name": "ETHOS_PYMUPDF4LLM_INSTALL_PATH",
      "notes": [],
      "path": "/private/tmp/ethos-pymupdf4llm-venv312",
      "path_kind": "directory",
      "role": "PyMuPDF4LLM installed footprint path measured by the harness.",
      "sha256": null,
      "size_bytes": 214870273,
      "status": "resolved",
      "tree_sha256": "1934892a52fe3dc713c535883a4c46320dbfadb8c2a264c2e643eaec49892905",
      "value": "/private/tmp/ethos-pymupdf4llm-venv312"
    }
  ]
}
