{
  "blockers": [
    "ETHOS_PDFIUM_LIBRARY_PATH is not set",
    "ETHOS_PDFIUM_VERSION is not set",
    "ETHOS_PDFIUM_ARTIFACT_PATH is not set",
    "ETHOS_OPENDATALOADER_PDF_BIN is not set",
    "ETHOS_OPENDATALOADER_PDF_ARTIFACT is not set",
    "ETHOS_OPENDATALOADER_PDF_INSTALL_PATH is not set",
    "ETHOS_EDGEPARSE_BIN is not set",
    "ETHOS_EDGEPARSE_ARTIFACT is not set",
    "ETHOS_EDGEPARSE_INSTALL_PATH is not set",
    "ETHOS_LITEPARSE_BIN is not set",
    "ETHOS_LITEPARSE_ARTIFACT is not set",
    "ETHOS_LITEPARSE_INSTALL_PATH is not set",
    "ETHOS_PYMUPDF4LLM_PYTHON is not set",
    "ETHOS_PYMUPDF4LLM_ARTIFACT is not set",
    "ETHOS_PYMUPDF4LLM_INSTALL_PATH is not set"
  ],
  "schema_version": "ethos-gate-zero-reproduction-env-v1",
  "source": "environment",
  "status": "incomplete",
  "variables": [
    {
      "exists": null,
      "expected_sha256": null,
      "hash_matches_expected": null,
      "kind": "file",
      "name": "ETHOS_PDFIUM_LIBRARY_PATH",
      "notes": [],
      "path": null,
      "path_kind": null,
      "role": "Pinned PDFium dynamic library loaded by ethos-pdf.",
      "sha256": null,
      "size_bytes": null,
      "status": "unresolved",
      "tree_sha256": null,
      "value": null
    },
    {
      "exists": null,
      "expected_sha256": null,
      "hash_matches_expected": null,
      "kind": "value",
      "name": "ETHOS_PDFIUM_VERSION",
      "notes": [],
      "path": null,
      "path_kind": null,
      "role": "Pinned upstream PDFium version string.",
      "sha256": null,
      "size_bytes": null,
      "status": "unresolved",
      "tree_sha256": null,
      "value": null
    },
    {
      "exists": null,
      "expected_sha256": null,
      "hash_matches_expected": null,
      "kind": "file",
      "name": "ETHOS_PDFIUM_ARTIFACT_PATH",
      "notes": [],
      "path": null,
      "path_kind": null,
      "role": "Pinned PDFium artifact archive.",
      "sha256": null,
      "size_bytes": null,
      "status": "unresolved",
      "tree_sha256": null,
      "value": null
    },
    {
      "competitor_id": "opendataloader-pdf",
      "exists": null,
      "expected_sha256": null,
      "hash_matches_expected": null,
      "kind": "file",
      "name": "ETHOS_OPENDATALOADER_PDF_BIN",
      "notes": [],
      "path": null,
      "path_kind": null,
      "role": "OpenDataLoader command used by the Gate Zero harness.",
      "sha256": null,
      "size_bytes": null,
      "status": "unresolved",
      "tree_sha256": null,
      "value": null
    },
    {
      "competitor_id": "opendataloader-pdf",
      "exists": null,
      "expected_sha256": "1c359183650f4c012875010c156f13b6d3477b00762b8e3fbd8479fa03feb628",
      "hash_matches_expected": null,
      "kind": "file",
      "name": "ETHOS_OPENDATALOADER_PDF_ARTIFACT",
      "notes": [],
      "path": null,
      "path_kind": null,
      "role": "OpenDataLoader pinned artifact used to install/run the command.",
      "sha256": null,
      "size_bytes": null,
      "status": "unresolved",
      "tree_sha256": null,
      "value": null
    },
    {
      "competitor_id": "opendataloader-pdf",
      "exists": null,
      "expected_sha256": null,
      "hash_matches_expected": null,
      "kind": "directory",
      "name": "ETHOS_OPENDATALOADER_PDF_INSTALL_PATH",
      "notes": [],
      "path": null,
      "path_kind": null,
      "role": "OpenDataLoader installed footprint path measured by the harness.",
      "sha256": null,
      "size_bytes": null,
      "status": "unresolved",
      "tree_sha256": null,
      "value": null
    },
    {
      "competitor_id": "edgeparse",
      "exists": null,
      "expected_sha256": null,
      "hash_matches_expected": null,
      "kind": "file",
      "name": "ETHOS_EDGEPARSE_BIN",
      "notes": [],
      "path": null,
      "path_kind": null,
      "role": "EdgeParse command used by the Gate Zero harness.",
      "sha256": null,
      "size_bytes": null,
      "status": "unresolved",
      "tree_sha256": null,
      "value": null
    },
    {
      "competitor_id": "edgeparse",
      "exists": null,
      "expected_sha256": "82a6fdd81f2bfac4a3b8aedd06e055ae67ec8a2d1c879fb6327259caa13f5a69",
      "hash_matches_expected": null,
      "kind": "file",
      "name": "ETHOS_EDGEPARSE_ARTIFACT",
      "notes": [],
      "path": null,
      "path_kind": null,
      "role": "EdgeParse pinned artifact used to install/run the command.",
      "sha256": null,
      "size_bytes": null,
      "status": "unresolved",
      "tree_sha256": null,
      "value": null
    },
    {
      "competitor_id": "edgeparse",
      "exists": null,
      "expected_sha256": null,
      "hash_matches_expected": null,
      "kind": "directory",
      "name": "ETHOS_EDGEPARSE_INSTALL_PATH",
      "notes": [],
      "path": null,
      "path_kind": null,
      "role": "EdgeParse installed footprint path measured by the harness.",
      "sha256": null,
      "size_bytes": null,
      "status": "unresolved",
      "tree_sha256": null,
      "value": null
    },
    {
      "competitor_id": "liteparse",
      "exists": null,
      "expected_sha256": null,
      "hash_matches_expected": null,
      "kind": "file",
      "name": "ETHOS_LITEPARSE_BIN",
      "notes": [],
      "path": null,
      "path_kind": null,
      "role": "LiteParse command used by the Gate Zero harness.",
      "sha256": null,
      "size_bytes": null,
      "status": "unresolved",
      "tree_sha256": null,
      "value": null
    },
    {
      "competitor_id": "liteparse",
      "exists": null,
      "expected_sha256": "1486987ef620cec06b8dfc365505f15cd5cd4bb05dac3775d260633df7060779",
      "hash_matches_expected": null,
      "kind": "file",
      "name": "ETHOS_LITEPARSE_ARTIFACT",
      "notes": [],
      "path": null,
      "path_kind": null,
      "role": "LiteParse pinned artifact used to install/run the command.",
      "sha256": null,
      "size_bytes": null,
      "status": "unresolved",
      "tree_sha256": null,
      "value": null
    },
    {
      "competitor_id": "liteparse",
      "exists": null,
      "expected_sha256": null,
      "hash_matches_expected": null,
      "kind": "directory",
      "name": "ETHOS_LITEPARSE_INSTALL_PATH",
      "notes": [],
      "path": null,
      "path_kind": null,
      "role": "LiteParse installed footprint path measured by the harness.",
      "sha256": null,
      "size_bytes": null,
      "status": "unresolved",
      "tree_sha256": null,
      "value": null
    },
    {
      "competitor_id": "pymupdf4llm",
      "exists": null,
      "expected_sha256": null,
      "hash_matches_expected": null,
      "kind": "file",
      "name": "ETHOS_PYMUPDF4LLM_PYTHON",
      "notes": [],
      "path": null,
      "path_kind": null,
      "role": "PyMuPDF4LLM Python interpreter used by the Gate Zero harness.",
      "sha256": null,
      "size_bytes": null,
      "status": "unresolved",
      "tree_sha256": null,
      "value": null
    },
    {
      "competitor_id": "pymupdf4llm",
      "exists": null,
      "expected_sha256": "bd724b79fa3f06a5b28d7a65f7acfa8de56e04bdb603ac2d6dff315e0d151aaa",
      "hash_matches_expected": null,
      "kind": "file",
      "name": "ETHOS_PYMUPDF4LLM_ARTIFACT",
      "notes": [],
      "path": null,
      "path_kind": null,
      "role": "PyMuPDF4LLM pinned artifact used to install/run the command.",
      "sha256": null,
      "size_bytes": null,
      "status": "unresolved",
      "tree_sha256": null,
      "value": null
    },
    {
      "competitor_id": "pymupdf4llm",
      "exists": null,
      "expected_sha256": null,
      "hash_matches_expected": null,
      "kind": "directory",
      "name": "ETHOS_PYMUPDF4LLM_INSTALL_PATH",
      "notes": [],
      "path": null,
      "path_kind": null,
      "role": "PyMuPDF4LLM installed footprint path measured by the harness.",
      "sha256": null,
      "size_bytes": null,
      "status": "unresolved",
      "tree_sha256": null,
      "value": null
    }
  ]
}
